{
  "manifest_version": "1.0.0",
  "run_id": "11111111-1111-4111-8111-111111111111",
  "skill_ref": {
    "name": "PDF Reader",
    "version": "2.4.0"
  },
  "included": [
    {
      "id": "a_001",
      "kind": "action",
      "reason": "requested local PDF extraction",
      "tokens": 80
    },
    {
      "id": "r_001",
      "kind": "rule",
      "reason": "input existence precondition",
      "tokens": 40
    }
  ],
  "excluded": [
    {
      "id": "d_009",
      "kind": "directive",
      "reason": "network strategy is irrelevant to a local read",
      "risk": "low"
    }
  ],
  "token_budget": {
    "target": 1500,
    "actual": 120,
    "estimator": "example-tokenizer-v1"
  },
  "created_at": "2026-07-12T12:00:00Z"
}
